{
  "name": "magic-swirl",
  "description": "Magical swirling particles with rainbow colors",
  "tags": ["magic", "swirl", "colorful", "fantasy"],
  "suggestedQuality": "high",
  "emitters": [
    {
      "type": "point",
      "rate": 300,
      "maxParticles": 5000,
      "lifetime": [2, 4],
      "velocityRange": {
        "min": [-0.5, -0.5, -0.5],
        "max": [0.5, 0.5, 0.5]
      },
      "position": [0, 0, 0]
    }
  ],
  "physics": {
    "gravity": [0, 0, 0],
    "drag": 0.2,
    "curlNoise": true,
    "curlNoiseFrequency": 1.0,
    "curlNoiseAmplitude": 3.0,
    "vorticity": true,
    "vorticityStrength": 5.0
  },
  "renderer": {
    "mode": "auto",
    "shaderTemplate": "magic_swirl",
    "particleSize": 8,
    "sizeAttenuation": true,
    "blendMode": "additive",
    "postProcessing": {
      "bloom": {
        "enabled": true,
        "strength": 1.5,
        "radius": 0.9
      }
    }
  },
  "duration": 0
}
