{
  "name": "aurora",
  "description": "Aurora borealis effect with flowing colored particles",
  "tags": ["aurora", "magical", "colorful", "atmospheric"],
  "suggestedQuality": "high",
  "emitters": [
    {
      "type": "box",
      "rate": 150,
      "maxParticles": 6000,
      "lifetime": [5, 8],
      "velocityRange": {
        "min": [-1, -0.2, -0.5],
        "max": [1, 0.2, 0.5]
      },
      "position": [0, 3, 0],
      "params": {
        "size": [10, 1, 5]
      }
    }
  ],
  "physics": {
    "gravity": [0, 0, 0],
    "drag": 0.05,
    "curlNoise": true,
    "curlNoiseFrequency": 0.4,
    "curlNoiseAmplitude": 2.0
  },
  "renderer": {
    "mode": "auto",
    "shaderTemplate": "magic_swirl",
    "particleSize": 12,
    "sizeAttenuation": true,
    "blendMode": "additive",
    "postProcessing": {
      "bloom": {
        "enabled": true,
        "strength": 1.2,
        "radius": 1.0
      }
    }
  },
  "duration": 0
}
